"text","links","permalink","username","date","photo0","photo1","photo2","photo3"
"Trying to decide what to wear to the grocery store with my parents. 1. #MarchMadness Jocularity 2. Victoria’s Secret Covid Collection 3. Puttin’ on the Risk 4. Desperado for #toiletpaper 5. Rolling Stones- Sharpie High . #QuaratineLife #StayAtHome #Masks4All ","","https://twitter.com/RachaelSpatula/status/1246509448228724738","RachaelSpatula","2020-04-04 18:46:26+00:00","https://pbs.twimg.com/media/EUx9vFUXgAA4sfC.jpg","","",""
"I'm a #maskengineer. #Masks4All #SewingCircle #DoingOurPart #21stCenturyRosie You?","","https://twitter.com/heyheatherirene/status/1246509411570462721","heyheatherirene","2020-04-04 18:46:17+00:00","https://pbs.twimg.com/media/EUx9sncXYAIeZfw.jpg","","",""
"Here is another “no sew” #facemasks - upside down eye mask. Hey @JetBlue glad I saved all these from red eye flights!! #coronavirus #COVID19 #Masks4All ","","https://twitter.com/angelsgrant/status/1246508820404322304","angelsgrant","2020-04-04 18:43:56+00:00","https://pbs.twimg.com/media/EUx9KcLXkAUz9Dt.jpg","","",""
"#Masks4All spare six mins to watch this video and make it more viral than https://youtu.be/E1DPBGEFfnw I PROTECT YOU. YOU PROTECT ME. WEAR MASK ","https://youtu.be/E1DPBGEFfnw","https://twitter.com/josebastid/status/1246508737801707522","josebastid","2020-04-04 18:43:36+00:00","https://pbs.twimg.com/media/EUx9EsgXYAAqU-_.jpg","","",""
"#COVID19 we pivoted manufacturing #PPEshortage making 1,000 #Masks4All daily ($3.50 each) for #military daily use, first responders, police, fire - not for clinical or hospital use. Made in Rhode Island Berry compliant washable &amp;reusable. Available immediate delivery #COVID19US","","https://twitter.com/Jonathan_D_Long/status/1246508330559963139","Jonathan_D_Long","2020-04-04 18:41:59+00:00","https://pbs.twimg.com/media/EUx8HjHXsAEBebR.jpg","","",""
"Fabric Face Mask, Breathable Washable Reusable 100% Cotton https://www.etsy.com/shop/MalaPicolla #etsy #EtsySocial #etsystore #etsyhandmade #handmade #etsyspecialt #etsymntt #EtsyTeamUNITY #Masks4All #Masks #Masks #facemask #facemasks4all #FacemaskForSale #facemasks","https://www.etsy.com/shop/MalaPicolla","https://twitter.com/mala_picolla/status/1246508300545536001","mala_picolla","2020-04-04 18:41:52+00:00","https://pbs.twimg.com/media/EUx7i4NWsAAufWF.jpg","","",""
"CDC can bite me since January #CDC_LIES #Masks4All #MasksSavesLives","","https://twitter.com/STOP_SARS_CoV_2/status/1246508288667267073","STOP_SARS_CoV_2","2020-04-04 18:41:49+00:00","https://pbs.twimg.com/media/EUx8rrXXsAIiIbJ.jpg","","",""
"Pre-order a washable mask. Made in NC. https://www.smartmasks.co #Masks4All ","https://www.smartmasks.co","https://twitter.com/smartmasksco/status/1246508187571945485","smartmasksco","2020-04-04 18:41:25+00:00","https://pbs.twimg.com/media/EUx8Y14XgAMXqtQ.jpg","","",""
"Not only #nyccoronavirus lack #Ventilator, but also @NYGovCuomo @NYCMayor @MTA lack brain, #Masks4All @VP @CDCDirector @MikeBloomberg @GovMurphy @GovWhitmer @MayorMikeDuggan @LouisianaGov @MassGovernor @RonDeSantisFL @GovPritzker @GovernorTomWolf @GovKemp #NYCLockdown @JeffBezos https://twitter.com/elonmusk/status/1246487833025576961","https://twitter.com/elonmusk/status/1246487833025576961","https://twitter.com/texas_swift/status/1246508158228414464","texas_swift","2020-04-04 18:41:18+00:00","https://pbs.twimg.com/media/EUx26PAUMAANdQc.jpg","https://pbs.twimg.com/media/EUx3FzsUMAAKWik.jpg","https://pbs.twimg.com/media/EUx6aHxUUAAo1If.jpg",""
"Simple Dummy-Proof Training on Affiliate Marketing. Watch how the Top Marketers get it done. “FREE WEBINAR” 45 SPOTS LEFT #makemoneyonline #internet #onlinelearning #coronavirus #Masks4All ","","https://twitter.com/InternetMentorz/status/1246507975159799809","InternetMentorz","2020-04-04 18:40:34+00:00","https://pbs.twimg.com/media/EUx8ZWzXYAI2Pus.jpg","","",""
"Version #2 of my happymasks. Everyone should be wearing these to share the happy #happymasks #sharethelove #Masks4All #Masks #COVID2019 #coronavirus #sharethehappy","","https://twitter.com/likebutter1/status/1246507855458467840","likebutter1","2020-04-04 18:40:06+00:00","https://pbs.twimg.com/media/EUx7xT2XgAI8tlk.jpg","","",""
"My first mask. I'm going grocery shopping but it feels like I'm going to battle. Y'all be safe. #Masks4All ","","https://twitter.com/rose_stabler/status/1246507760407248898","rose_stabler","2020-04-04 18:39:43+00:00","https://pbs.twimg.com/media/EUx8M07WkAgungy.jpg","","",""
"Pro-tip for new mask wearers: spray some essential oils in your mask to keep it fresh! I prefer eucalyptus and spearmint. Only a few bucks on Amazon. #Masks4All ","","https://twitter.com/JusticeTristan/status/1246507675971657728","JusticeTristan","2020-04-04 18:39:23+00:00","https://pbs.twimg.com/media/EUx8H0TXgAEcOrk.jpg","","",""
"F*ck it mask of--wait, no mask on! #Masks4All #WearAMask #DIYMask #TuxedoMask","","https://twitter.com/prof_carrington/status/1246507637270863879","prof_carrington","2020-04-04 18:39:14+00:00","https://pbs.twimg.com/media/EUx8FpkX0AAb3fA.jpg","","",""
"Trump: “It’s the Obama administration’s fault for the shortage of masks & ventilators!” #Masks4All #FrontLineHeroes","","https://twitter.com/Loma5360/status/1246507237125664769","Loma5360","2020-04-04 18:37:38+00:00","https://pbs.twimg.com/media/EUx7uSVUUAEj9Wg.jpg","","",""
"A nurse practitioner told our Glendale, AZ team that her pediatric clinic was almost out of paper masks. When she picked up the sparkly unicorn masks that the team sewed for #Masks4Millions, she got teary-eyed. ""She said, 'You're saving lives. You really are.'"" #Masks4All ","","https://twitter.com/DaysForGirls/status/1246506845298200576","DaysForGirls","2020-04-04 18:36:05+00:00","https://pbs.twimg.com/media/EUx7WeKXgAEOAgT.jpg","https://pbs.twimg.com/media/EUx7XNKXsAIIaBH.jpg","",""
"#WearAMask #Masks4All The Best Scarf &amp; Bandana pictures. The New Fashion #maskchallange #SaturdayThoughts #SaturdayVibes #SaturdayMotivation #SaturdayMorning #covid_2019 #SocialDistancing #mask #COVID19 #COVIDIDIOT #coronavirus #CornavirusOutbreak #CoronavirusUS #CDC @CDCgov","","https://twitter.com/AlanPortell/status/1246506411263213569","AlanPortell","2020-04-04 18:34:22+00:00","https://pbs.twimg.com/media/EUx69DQXYAI39jV.jpg","https://pbs.twimg.com/media/EUx69DRWkAESnLc.jpg","https://pbs.twimg.com/media/EUx69DlXgAI75wm.jpg","https://pbs.twimg.com/media/EUx69DhWoAAxuvC.jpg"
"My boss remembered that I know how to sew. She asked if was making masks? So now I’m making as many as I can and handing them out with no charge. I’m just making them with . And listening to Jaymes Young. #Masks4All #JaymesYoung #sewingfacemasks","","https://twitter.com/BarreraAka/status/1246506349212528641","BarreraAka","2020-04-04 18:34:07+00:00","https://pbs.twimg.com/media/EUx65_5UEAANV1m.jpg","https://pbs.twimg.com/media/EUx65_5UMAAM4vy.jpg","https://pbs.twimg.com/media/EUx66BhUUAEsGbJ.jpg",""
"There are lots of facts in this article that show that it *does* help. We still need to stay home (esp. when sick), wash our hands, and stay at least 6 feet apart, but masks will help too. #Masks4All ","https://smartairfilters.com/en/blog/best-materials-make-diy-face-mask-virus/","https://twitter.com/ErinHott/status/1246505640802930688","ErinHott","2020-04-04 18:31:18+00:00","https://pbs.twimg.com/media/EUtHRLOXQAQjiYj.jpg","","",""
"She sewed herself a mask! This is her own design from a pair of old leggings #repurpose #reuse #Masks4All #COVID19 #creativekids #sewingfacemasks #kidssewing We scavenged elastic from old pair of pants","","https://twitter.com/StellarCoach/status/1246505190670454785","StellarCoach","2020-04-04 18:29:31+00:00","https://pbs.twimg.com/media/EUx51k9WkAEm_1c.jpg","https://pbs.twimg.com/media/EUx52ofWkAk9_rd.jpg","",""
"2 Many DJ's: As Heard on Radio Soulwax Pt. 2 Haphazard solution. It may be effective for a few seconds, before you just need to reach for a gasp. Do not try this at home. Estimated effectiveness: 1/10 #Masks4All ","","https://twitter.com/fabiolug/status/1246505032528416768","fabiolug","2020-04-04 18:28:53+00:00","https://pbs.twimg.com/media/EUxsGnVXsAAgqrl.jpg","","",""
"More #Masks4All tips — if you’re using suboptimal elastic or your ears are tired and you have enamel pins you can pin your mask to your hat. Ppl are also sewing buttons to headbands but this is an alternative. Just make sure it’s a locking pin back. ","","https://twitter.com/grayestofghosts/status/1246504879662796800","grayestofghosts","2020-04-04 18:28:16+00:00","https://pbs.twimg.com/media/EUx5kCxWkAEaIFM.jpg","https://pbs.twimg.com/media/EUx5kCwWoAMkkhN.jpg","",""
"Yeah. Just look. Even the Dave Clark Five wore masks. #CoronavirusPandemic #CoronavirusOutbreak #coronapocalypse #MasksNow #Masks4All ","","https://twitter.com/50Lux14/status/1246504324265435138","50Lux14","2020-04-04 18:26:04+00:00","https://pbs.twimg.com/media/EUulvwTUYAAsxnQ.jpg","https://pbs.twimg.com/media/EUulwPyU8AAQRTt.jpg","https://pbs.twimg.com/media/EUulwZWUUAArCnz.jpg","https://pbs.twimg.com/media/EUulxZSUUAExABn.jpg"
"Think of those who you love. Don’t kill them with your stupidity: #Coronavirustruth #coronavirus #COVID19 #nomask #Masks4All ","","https://twitter.com/election16news/status/1246504053846269959","election16news","2020-04-04 18:25:00+00:00","https://pbs.twimg.com/media/EUx4zCRXYAA1aUQ.jpg","","",""
"Headed to grocery store. Mask ready to go. Can’t say I am thrilled with wearing a mask. As a smart friend said, “think of it as wearing a seat belt”. Okay fine. Seat belt on.. let’s do this. #Masks4All #mask","","https://twitter.com/BradBurke312/status/1246503904285798400","BradBurke312","2020-04-04 18:24:24+00:00","https://pbs.twimg.com/media/EUx_JQKXkAEUbr2.jpg","","",""
"The key issue is that lack of leadership on face masks. Where does the virus exit the body? The nose and mouth. Where does the virus primarily enter the body? The nose and mouth (yes, eyes are possible too). Face masks work and we need everyone covering their faces. #Masks4All","","https://twitter.com/MasksAsap/status/1246503386821865473","MasksAsap","2020-04-04 18:22:20+00:00","https://pbs.twimg.com/media/EUxF_KrX0AExqdm.jpg","","",""
"Why not take a hard look at what is working in other countries rather than whatever myopic lens it is you're looking through? Every country that has been successful in halting the virus spread has ubiquitous face mask wearing by the general public. #Masks4All","","https://twitter.com/MasksAsap/status/1246502759005913088","MasksAsap","2020-04-04 18:19:51+00:00","https://pbs.twimg.com/media/EUxF_KrX0AExqdm.jpg","","",""
"BREAKING NEWS! Hozho is NOT the new member of @slipknot Although he could be, like a second DJ or something... #PlagueDoctor #Masks4All ","","https://twitter.com/_hozho_/status/1246502698565976064","_hozho_","2020-04-04 18:19:36+00:00","https://pbs.twimg.com/media/EUx3l0YX0AYbVEs.jpg","","",""
"Done with my five masks for the day. I didn't sew all the way through, I stopped for lunch and retweeted some stuff and made fun of an anime Nazi - but I'm getting quicker and quicker at this. #Masks4All https://twitter.com/Antifagator/status/1246479687787872258","https://twitter.com/Antifagator/status/1246479687787872258","https://twitter.com/Antifagator/status/1246502586523553794","Antifagator","2020-04-04 18:19:10+00:00","https://pbs.twimg.com/media/EUx3bYzWkAAB7Y8.jpg","","",""
"Mask up #Coronavirus #CoronaCrisisuk #lockdown #Masks4All #CoronavirusScotland #Corvid19 #SARSCoV2 #maskup #CoronavirusLockdownUK #CoronavirusPandemic #stayhome #staysafe #StayHomeStaySafe #NHSThankYou #NHSCovidHeroes #NHSheroes","","https://twitter.com/daisyscoldwater/status/1246502519683067911","daisyscoldwater","2020-04-04 18:18:54+00:00","https://pbs.twimg.com/media/EUx3bteX0AMq_dP.jpg","","",""
"#Masks4All The Best Scarf &amp; Bandana pictures. The New Fashion. #maskchallange #SaturdayThoughts #SaturdayVibes #SaturdayMotivation #SaturdayMorning #fasion #SocialDistancing #mask #COVID2019 #Covid19Out #COVIDIDIOT #coronavirus #CornavirusOutbreak #CoronavirusUS #CDC @CDCgov","","https://twitter.com/AlanPortell/status/1246502433993502722","AlanPortell","2020-04-04 18:18:33+00:00","https://pbs.twimg.com/media/EUx3WJaXgAIMhC4.jpg","https://pbs.twimg.com/media/EUx3WJdXYAAAicy.jpg","https://pbs.twimg.com/media/EUx3WJsXQAAkle-.jpg","https://pbs.twimg.com/media/EUx3WJnXkAIgidS.jpg"
"A simple DIY 3 layer face mask instruction. Pls share and feedback. Be safe #Masks4All #Masks4Allusa can stitch or staple step-4","","https://twitter.com/Mahinth/status/1246502204162347008","Mahinth","2020-04-04 18:17:39+00:00","https://pbs.twimg.com/media/EUx3JZBWAAED4_U.jpg","","",""
"The new normal is weird --- but it's living! Get yer hankies out and send good masks to front line doctors and nurses #StayHome #MaskUp #Masks4All ","","https://twitter.com/charleshernick/status/1246502146746601473","charleshernick","2020-04-04 18:17:25+00:00","https://pbs.twimg.com/media/EUx3FvaXYAAKXcs.jpg","","",""
"We’re wrapping up our homemade mask project after 10 days & over 1,000 masks donated to healthcare and COVID first responders in Miami and as far as NY, NJ, CA & DC. All in it together #Masks4All #homemadeMasks #PPENow","","https://twitter.com/newmiamimama301/status/1246501938360975365","newmiamimama301","2020-04-04 18:16:35+00:00","https://pbs.twimg.com/media/EUx25rCXYAIuD-d.jpg","https://pbs.twimg.com/media/EUx25rGXYAAC8gv.jpg","https://pbs.twimg.com/media/EUx25rDWAAA5whR.jpg","https://pbs.twimg.com/media/EUx25rCWAAAOXS6.jpg"
"Easter Bunny's mask protects you -- your mask protects Easter Bunny #Masks4All [via @lilacchocolates]","","https://twitter.com/walterolson/status/1246501901174296576","walterolson","2020-04-04 18:16:26+00:00","https://pbs.twimg.com/media/EUx23MYXYAI_EvD.jpg","","",""
"#Czechia has important messages to share with those interested in #flatteningthecurve . It has adopted a strategy of #Masks4All . The more we in other countries can learn from #Czechia the greater our chances of saving lives ","","https://twitter.com/ClarkAllister/status/1246501686941802498","ClarkAllister","2020-04-04 18:15:35+00:00","https://pbs.twimg.com/media/EUvvo2zXYAAR6sP.png","","",""
"Join us! Telephone Town Hall April 7 w/ CA State Assemblymember @BuffyWicks and @supejohngioia re: #COVID19 #coronavirus #masks4all RSVP by email: Assemblymember.Wicks@assembly.ca.gov and write: ""Town Hall"" in subject line @WeArePHA https://bit.ly/2weDsG3","https://bit.ly/2weDsG3","https://twitter.com/roberthrogers1/status/1246501570583257088","roberthrogers1","2020-04-04 18:15:07+00:00","https://pbs.twimg.com/media/EUx2W4lU8AACLoC.jpg","","",""
"FYI— the economics of #Masks4All https://twitter.com/tanyatussing/status/1245766496250454027?s=21","https://twitter.com/tanyatussing/status/1245766496250454027?s=21,https://twitter.com/tanyatussing/status/1245766496250454027","https://twitter.com/tanyatussing/status/1246501483085991938","tanyatussing","2020-04-04 18:14:47+00:00","https://pbs.twimg.com/media/EUx0Qv8VAAEwyEH.jpg","","",""
"Wearinng a mask #Masks4All will not kill people, ignorance will.","","https://twitter.com/_Lu_Chen/status/1246501355545559045","_Lu_Chen","2020-04-04 18:14:16+00:00","https://pbs.twimg.com/media/EUxF_KrX0AExqdm.jpg","","",""
"This has important implications for control of COVID-19, suggesting that surgical face masks could be used by ill people to reduce onward transmission."" #Masks4All","","https://twitter.com/MasksAsap/status/1246500903617794048","MasksAsap","2020-04-04 18:12:28+00:00","https://pbs.twimg.com/media/EUxF_KrX0AExqdm.jpg","","",""
"#Masks in bulk. Order in minutes. N95, KN95 and 3 ply-surgical masks. #Masks4All ","","https://twitter.com/MerkinChief/status/1246500626462375938","MerkinChief","2020-04-04 18:11:22+00:00","https://pbs.twimg.com/media/EUx1tbBWoAAe_wU.jpg","","",""
"#Masks4All The Best Scarf &amp; Bandana pictures. The New Fashion. #maskchallange #SaturdayThoughts #SaturdayVibes #SaturdayMotivation #SaturdayMorning #fasion #SocialDistancing #mask #COVID2019 #Covid19Out #COVIDIDIOT #coronavirus #CornavirusOutbreak #CoronavirusUS #CDC @CDCgov","","https://twitter.com/merryjoportell/status/1246500442491826183","merryjoportell","2020-04-04 18:10:39+00:00","https://pbs.twimg.com/media/EUx1hMrXkAA0K-j.jpg","https://pbs.twimg.com/media/EUx1hMsXsAEuaI_.jpg","https://pbs.twimg.com/media/EUx1hM_XQAAdNtz.jpg","https://pbs.twimg.com/media/EUx1hwmWAAQ2A9F.jpg"
"@jeremyphoward #Masks4All at last in Lombardy! ","","https://twitter.com/fgianferrari/status/1246500266750414848","fgianferrari","2020-04-04 18:09:57+00:00","https://pbs.twimg.com/media/EUx1YV2WAAA7rwL.jpg","","",""
"Thank you @winniesun ! It's something we can all do to #FlattenTheCurve #StayingAliveTogether #Masks4All","","https://twitter.com/nkagetsu/status/1246500161578323969","nkagetsu","2020-04-04 18:09:32+00:00","https://pbs.twimg.com/media/EUxs1gdU8AArqgu.jpg","","",""
"5th grade #MATRIX student, Andrew S. took the #facemask challenge and sent this photo! Who’s going to be next to try this?! #wyproud #wyasd #Masks4All ","","https://twitter.com/HenRyCreated/status/1246499903196532736","HenRyCreated","2020-04-04 18:08:30+00:00","https://pbs.twimg.com/media/EUx1DTvWAAA5HUw.jpg","https://pbs.twimg.com/media/EUx1DTsWoAAYWql.jpg","",""
"Yes, there's plenty reusable, cloth, decorative masks online .. you need to know how to look for them: don't get discouraged if it's not coming until May -you're gonna need it for a long time -it generally comes much faster #Masks4All #COVID19","","https://twitter.com/karynpalminteri/status/1246499534106251265","karynpalminteri","2020-04-04 18:07:02+00:00","https://pbs.twimg.com/media/EUx0feJWsAAsX2A.jpg","","",""
"Art Ensemble Of Chicago: Coming Home Jamaica A series of full-face wooden masks, which may (or may not!) hide filters behind the mouth holes. They truly look great, but also a little bit of a gamble. I'd go with the third one from left. Estimated effectiveness: 6/10 #Masks4All ","","https://twitter.com/fabiolug/status/1246499145197723649","fabiolug","2020-04-04 18:05:29+00:00","https://pbs.twimg.com/media/EUxsGnVXsAAgqrl.jpg","","",""
"When fabric becomes a commodity and solid fabric in masculine colors is even harder to come by, sacrificing jeans is worth making sure my boys are safe. Thankful I’m not a skinny jeans kinda girl, SEE! Thick thighs do save lives. #Masks4All ","","https://twitter.com/DebiHammel/status/1246499117825695744","DebiHammel","2020-04-04 18:05:23+00:00","https://pbs.twimg.com/media/EUx0VcQXkAI1ubn.jpg","","",""
"Given the studies done on the efficacy of masks to help combat the #coronavirus pandemic, I have decided to support the #Masks4All movement. So I made a couple of memes to pass around. #covid19 Images are from Maldivian designer @FamushuBoutique and NZ designer Karen Walker.","","https://twitter.com/mujunaeem/status/1246499098443776001","mujunaeem","2020-04-04 18:05:18+00:00","https://pbs.twimg.com/media/EUx0TJLWoAITOxJ.jpg","https://pbs.twimg.com/media/EUx0TJGWsAA1vVv.jpg","",""
"thanks Jeremy & Balaji - have added #Masks4All to http://bit.ly/PPEIndex. folks with additional questions should see @PPECoalition for more information.","http://bit.ly/PPEIndex","https://twitter.com/Pistachio/status/1246498994022465541","Pistachio","2020-04-04 18:04:53+00:00","https://pbs.twimg.com/media/EUv67hOUMAA9a6_.jpg","","",""
"COVID-19 Telephone Town Hall April 7 -- #COVID19 @BuffyWicks #coronavirus #masks4all @CoCoHealth https://conta.cc/3dOONxv","https://conta.cc/3dOONxv","https://twitter.com/supejohngioia/status/1246498372682502144","supejohngioia","2020-04-04 18:02:25+00:00","https://pbs.twimg.com/media/EUxzqgFWkAI33g9.jpg","","",""
"COVID-19 Telephone Town Hall April 7 -- #COVID19 @BuffyWicks #coronavirus #masks4all @CoCoHealth https://conta.cc/3dOONxv","https://conta.cc/3dOONxv","https://twitter.com/roberthrogers1/status/1246498372300783618","roberthrogers1","2020-04-04 18:02:25+00:00","https://pbs.twimg.com/media/EUxzqfEWAAQK_Pe.jpg","","",""
"To all - Besides #Masks4All, these are simple but useful tips for fighting the #COVID19Pandemic. You can play a vital part in it. To Hong Kongers - remember to also support local conscientious businesses. #YellowEconomicCircle Pic from #30DaysToSaveAmerica @WarRoomPandemic.","","https://twitter.com/BoscoWo42122490/status/1246498338947485697","BoscoWo42122490","2020-04-04 18:02:17+00:00","https://pbs.twimg.com/media/EUxzn29U8AEtksK.jpg","https://pbs.twimg.com/media/EUxzn29UEAYpqJ4.jpg","https://pbs.twimg.com/media/EUxzn29U8AAQJkG.jpg","https://pbs.twimg.com/media/EUxzn4CU0AAMlMk.jpg"
"Support COVID-19 Care at @UHhospitals https://hubs.ly/H0p9S9Y0 | #masksforall #Masks4All | @PointRight","https://hubs.ly/H0p9S9Y0","https://twitter.com/kcodriscoll1/status/1246498309881171970","kcodriscoll1","2020-04-04 18:02:10+00:00","https://pbs.twimg.com/media/EUxzm2OXgAA0Vaq.png","","",""
"I can pretty much tell who has an irrational fear of the invisible boogie man or who envisions themselves one day appearing on the cover of Soldier of Fortune magazine by their stance on #Masks4All. It's not about whether it helps; it's how it makes them feel. ""But doctors...","","https://twitter.com/C4CEO/status/1246498257506906113","C4CEO","2020-04-04 18:01:58+00:00","https://pbs.twimg.com/media/EUx1-4sXkAQAm5e.jpg","https://pbs.twimg.com/media/EUx1_B8X0AEKNzk.jpg","",""
"Gonna try to make some masks using an HVAC filter. #coronavirus #COVID19 #PPE #Masks4All ","","https://twitter.com/BruceKLogan/status/1246497966208229376","BruceKLogan","2020-04-04 18:00:48+00:00","https://pbs.twimg.com/media/EUxzSjQXgAAwvev.jpg","https://pbs.twimg.com/media/EUxzSjQXgAIVjl9.jpg","",""
"don't wait for corrupt system to tell you what to do, in this case #WHO or any organization who is unfit to solve any minor issues let alone advise on life matter, MASK is a must vs #COVID2019 ask yourselves &amp;use logic #Masks4All will protect you &amp;others see the experts take! ","","https://twitter.com/ArsimmA/status/1246497885421801475","ArsimmA","2020-04-04 18:00:29+00:00","https://pbs.twimg.com/media/EUxy4ZfWkAUKOUn.jpg","","",""
"#masks4all Found these resources for sharing about using masks https://masks4all.org/ Here is the video https://youtu.be/jZtEX2-n2Hc https://www.instagram.com/p/B-kXXkEFRq-/?igshid=cv58k5sg81wt","https://masks4all.org/,https://youtu.be/jZtEX2-n2Hc,https://www.instagram.com/p/B-kXXkEFRq-/?igshid=cv58k5sg81wt","https://twitter.com/pixelhandler/status/1246497657071308802","pixelhandler","2020-04-04 17:59:34+00:00","https://pbs.twimg.com/media/EUx1Mo6UEAAhNmP.jpg","","",""
"I dream of one day, where humankind has learned to #BeHumbleNotArrogant. Opinions like that one, only hurt the valuable contributions of hardworking people like @jeremyphoward thanks to all supporters that helped our countries to bring #Masks4All ","","https://twitter.com/Tinker_MJ/status/1246497608421572609","Tinker_MJ","2020-04-04 17:59:23+00:00","https://pbs.twimg.com/media/EUxy9yRWoAA8Qg_.jpg","","",""
"Doing our part in public #TakeBackLocal #SocialDistanacing #Masks4All ","","https://twitter.com/GetLocable/status/1246497392230187010","GetLocable","2020-04-04 17:58:31+00:00","https://pbs.twimg.com/media/EUxywlVU0AEwzhF.jpg","","",""
"#Masks4All The Best Scarf &amp; Bandana pictures. The New Fashion. #maskchallange #SaturdayThoughts #SaturdayVibes #SaturdayMotivation #SaturdayMorning #fasion #SocialDistancing #mask #COVID2019 #Covid19Out #COVIDIDIOT #coronavirus #CornavirusOutbreak #CoronavirusUS #CDC @CDCgov","","https://twitter.com/StocksToBuy777/status/1246496981117218821","StocksToBuy777","2020-04-04 17:56:53+00:00","https://pbs.twimg.com/media/EUxyY9DWsAI_97o.jpg","https://pbs.twimg.com/media/EUxyY9EWkAAX80U.jpg","",""
"John Cale: Guts Perhaps realising the previous model's limitations, years later Cale came up with this intriguing redesign. A solid improvement, but would be nice to know the filter specs. Comes with a full-body suit. What's not to like? Estimated effectiveness: 8/10 #Masks4All ","","https://twitter.com/fabiolug/status/1246496647850442753","fabiolug","2020-04-04 17:55:34+00:00","https://pbs.twimg.com/media/EUxsGnVXsAAgqrl.jpg","","",""
"We all have friends like this! Let’s say a Prayer for them Today. #SaturdayThoughts #SaturdayMotivation #coronavirus #CoronavirusPandemic #Masks4All #MasksDoneWrong #No","","https://twitter.com/TheAlbyMetevier/status/1246496570863833093","TheAlbyMetevier","2020-04-04 17:55:15+00:00","https://pbs.twimg.com/media/EUxyBTkU4AAzd_H.jpg","https://pbs.twimg.com/media/EUxyBTnUcAAwDib.jpg","https://pbs.twimg.com/media/EUxyBTqUYAApRib.jpg",""
"We didn't wait for our government, we did it ourselves. #Masks4All #COVID19 Protect the others and you'll protect yourself!","","https://twitter.com/IvaSmidova/status/1246496359487885313","IvaSmidova","2020-04-04 17:54:25+00:00","https://pbs.twimg.com/media/EUxxCLsX0AUDk97.jpg","","",""
"If you can still unlock your iPhone with your Face Recognition in public, you’re not doing the #MaskUpPA right! Remember, “I protect you - You protect me!” #Masks4All - listen to @GovernorTomWolf and the experts! #COVID19","","https://twitter.com/Josh_HigherEd/status/1246495758142115840","Josh_HigherEd","2020-04-04 17:52:02+00:00","https://pbs.twimg.com/media/EUxxR36XgAAMO-p.jpg","","",""
"Who would have thunk that facial masks (not carnival) would be in fashion in Brazil in 2020? #covid19 #Masks4All ","","https://twitter.com/Mo_Americanoid/status/1246495659299143680","Mo_Americanoid","2020-04-04 17:51:38+00:00","https://pbs.twimg.com/media/EUxxMQAXQAADfhu.jpg","","",""
