"text","links","permalink","username","date","photo0","photo1","photo2","photo3"
"#WearAMask #Masks4All Best Scarf &amp; Bandana pictures. The New Fashion. #maskchallange #StopTheSpread #SaturdayThoughts #SaturdayVibes #SaturdayMotivation #covid @realDonaldTrump #SaturdayMood #covid_2019 #covid19 #CDC #SocialDistancing #mask #coronavirus #CornavirusOutbreak","","https://twitter.com/AlanPortell/status/1246548852758413314","AlanPortell","2020-04-04 21:23:00+00:00","https://pbs.twimg.com/media/EUyhkXEXYAACftk.jpg","https://pbs.twimg.com/media/EUyhkXEWAAIJPoS.jpg","https://pbs.twimg.com/media/EUyhkXLWkAESYu3.jpg","https://pbs.twimg.com/media/EUyhkXLXsAQg2vU.jpg"
"3 Layer Disposable Face Masks - IN-STOCK Ships from CA,USA *** SHOP HERE: https://bit.ly/34h4vNp * A Portion of all sales go to COVID-19 Solidarity Response Fund for ""WHO"" via: @BagzDepot #facemasks #COVID2019 #Stayhomestaysafe #Masks4All ","https://bit.ly/34h4vNp","https://twitter.com/BagzDepot/status/1246548119614935041","BagzDepot","2020-04-04 21:20:06+00:00","https://pbs.twimg.com/media/EUyg575UMAAbidS.jpg","","",""
"The ideal compromise to PROTECT PEOPLE AND KEEP THE ECONOMY RUNNING would be to allow people to go outside and work but wear facemasks. #coronavirus #Covid_19 #Masks4ALL","","https://twitter.com/theMain94518399/status/1246547843948720128","theMain94518399","2020-04-04 21:19:00+00:00","https://pbs.twimg.com/media/EUsXlHuXQAQ_tfU.jpg","","",""
"I think the ideal compromise to PROTECT PEOPLE AND KEEP THE ECONOMY RUNNING would be to allow people to go outside and work but wear facemasks. #coronavirus #Covid_19 #CoronavirusPandemic #Masks4ALL","","https://twitter.com/theMain94518399/status/1246547747341303808","theMain94518399","2020-04-04 21:18:37+00:00","https://pbs.twimg.com/media/EUxJrp9XgAEnU1B.jpg","","",""
"⁦@jeremyphoward⁩ Recent presentation from UCSF School of Medicine. Note how slide mentions “Culture of wearing masks in public”. #Masks4All ","","https://twitter.com/uwepleban/status/1246547733093257216","uwepleban","2020-04-04 21:18:33+00:00","https://pbs.twimg.com/media/EUygjY5X0AAd1H3.jpg","","",""
"Ventured to the grocery store today, Gov recommending wear mask, so it shall be #Masks4All plus we wore gloves, but I danced in the aisle when I ABBA's Dancing Queen came on, had my daughter laughing ","","https://twitter.com/TXFern75/status/1246547067796951043","TXFern75","2020-04-04 21:15:55+00:00","https://pbs.twimg.com/media/EUxW9WfWAAEWF6c.jpg","","",""
"Please, share: this is simple solution: I protect you, You protect me! It works in Czechia — look at this short video. Please, don’t trust @jairbolsonaro, #COVID19 isn’t “little flu”! #Masks4All! ","https://youtu.be/HhNo_IOPOtU","https://twitter.com/janhrabal/status/1246546941426782215","janhrabal","2020-04-04 21:15:25+00:00","https://pbs.twimg.com/media/EUwYQ5VXYAABg5P.jpg","","",""
"#Masks4All Generated using https://app.generative.photos/masks4all . I hope the service doesn’t sell the photos later.","https://app.generative.photos/masks4all","https://twitter.com/kracetheking/status/1246546910279634944","kracetheking","2020-04-04 21:15:17+00:00","https://pbs.twimg.com/media/EUyfzSFU0AARupI.jpg","","",""
"No mention of masks? #masks4all #communitymasking works skeptical? #czechthecurves","","https://twitter.com/marcbasch5/status/1246546824334368768","marcbasch5","2020-04-04 21:14:57+00:00","https://pbs.twimg.com/media/EUyaRwzX0AInvWv.jpg","","",""
"I felt like an older version of Butch Cassidy about to rob a bank. But it sends the right signal about distancing #SocialDistancing #COVID19 #Masks4All ","","https://twitter.com/TedSmyth/status/1246545835170684929","TedSmyth","2020-04-04 21:11:01+00:00","https://pbs.twimg.com/media/EUye0s7XYAEcPPN.jpg","","",""
"A bunch of random people wearing masks in 1918. What has happened to us? We all have a super computer in our pocket but we’re rationing masks, after it took our leaders and experts months to remember that masks save lives. #Masks4All ","","https://twitter.com/zackexley/status/1246545078333493248","zackexley","2020-04-04 21:08:01+00:00","https://pbs.twimg.com/media/EUycOBDUcAEY324.jpg","","",""
"Yes, and please wear a mask/ face cover if we have to go out. http://masks4all.co #masks4all","http://masks4all.co","https://twitter.com/JTxt/status/1246544941016207360","JTxt","2020-04-04 21:07:28+00:00","https://pbs.twimg.com/media/EUx6n92U8AAmAGv.jpg","","",""
"Covid-19 total estimated cases trajectories comparison of COUNTRIES WITH UBIQUITOUS MASK WEARING vs. COUNTRIES WITH LOW/MINORITY % MASK WEARING - Johns Hopkins Uni. data as of March 20/2020 #Masks4All #Masks #MasksSaveLives #COVID19 #coronavirus #COVID2019 #COVID19AB #Covid_19","","https://twitter.com/martialartssoul/status/1246544703522103296","martialartssoul","2020-04-04 21:06:31+00:00","https://pbs.twimg.com/media/EUydy30UwAIl6Wc.jpg","","",""
"Covid-19 total estimated cases trajectories comparison of COUNTRIES WITH UBIQUITOUS MASK WEARING vs. COUNTRIES WITH LOW/MINORITY % MASK WEARING - Johns Hopkins Uni. data as of March 20/2020 #Masks4All #Masks #MasksSaveLives #COVID19 #coronavirus #COVID2019 #COVID19AB #Covid_19","","https://twitter.com/martialartssoul/status/1246544465214529536","martialartssoul","2020-04-04 21:05:34+00:00","https://pbs.twimg.com/media/EUydk9rU8AAbbnN.jpg","","",""
"High school students wearing masks in 1918. All of these picts are from different cities btw from coast to coast. #Masks4All ","","https://twitter.com/zackexley/status/1246544308540334080","zackexley","2020-04-04 21:04:57+00:00","https://pbs.twimg.com/media/EUycOBDUcAEY324.jpg","","",""
"Made from 2 shop towels #Masks4All. ","","https://twitter.com/AnneClements11/status/1246544181385969664","AnneClements11","2020-04-04 21:04:27+00:00","https://pbs.twimg.com/media/EUydUn5XkAAj_9T.jpg","","",""
"Did this embroidery in 2 hours...Yaaay...I did it #embroidedart #embroidery #artwork #StayAtHomeChallenge #Creative #skills #Masks4All #HandmadeHour #handmade #skull ","","https://twitter.com/masitarich/status/1246544157260288001","masitarich","2020-04-04 21:04:21+00:00","https://pbs.twimg.com/media/EUyczNaXkAADJce.jpg","","",""
"This is what happens when a Country embraces Globalism. Worked out great didn't it? #Hydroxychloroquine #Masks4All #MadeInTheUSA #coronavirus #AmericaFirst #PPEshortage @HawleyMO","","https://twitter.com/Swampdo01077548/status/1246544067447738370","Swampdo01077548","2020-04-04 21:04:00+00:00","https://pbs.twimg.com/media/EUydOBeXQAEpPfC.jpg","","",""
"Here are police officers wearing masks in 1918. #Masks4All ","","https://twitter.com/zackexley/status/1246543837482213376","zackexley","2020-04-04 21:03:05+00:00","https://pbs.twimg.com/media/EUycOBDUcAEY324.jpg","","",""
"Here are street cleaners in 918 wearing masks, overseen by city officials wearing masks. #Masks4All ","","https://twitter.com/zackexley/status/1246543572423208960","zackexley","2020-04-04 21:02:01+00:00","https://pbs.twimg.com/media/EUycOBDUcAEY324.jpg","","",""
"Just sayin’ #Masks4All ","","https://twitter.com/MGS_PWN3R/status/1246543566148710403","MGS_PWN3R","2020-04-04 21:02:00+00:00","https://pbs.twimg.com/media/EUycw4lXgAIDZnF.jpg","","",""
"A fun and successful father/daughter sewing project today. I think they both turned out great! This video - the reason and inspiration: https://youtu.be/jZtEX2-n2Hc #Masks4All ","https://youtu.be/jZtEX2-n2Hc","https://twitter.com/streichforceone/status/1246543129467064320","streichforceone","2020-04-04 21:00:16+00:00","https://pbs.twimg.com/media/EUycSiYWkAAJyJu.jpg","","",""
"America lost 70,000 factories after NAFTA Today we can't provide the 79 cent #Masks4All #Nurses We rely on other Countries to produce the Medicines that will make us healthy. We have a President who wants Companies to return to the USA. Will #Congress wake up? #Democrats?","","https://twitter.com/Swampdo01077548/status/1246542989238902784","Swampdo01077548","2020-04-04 20:59:42+00:00","https://pbs.twimg.com/media/EUycPQFXgAU-dNY.jpg","","",""
"Here are office workers - not hc workers - wearing masks in the workplace in 1918. They were told by authorities to wear them, and society was able to supply them. What has happened to us? #Masks4All ","","https://twitter.com/zackexley/status/1246542965549367296","zackexley","2020-04-04 20:59:37+00:00","https://pbs.twimg.com/media/EUycOBDUcAEY324.jpg","","",""
"At the end, this video says masks may not be effective against inhaling, like many say. No doubt #Masks4All is much more effective at the source. But I don’t understand why it doesn’t also help prevent inhaling.","","https://twitter.com/akifujimura/status/1246542820023791616","akifujimura","2020-04-04 20:59:02+00:00","https://pbs.twimg.com/media/EUbcPmaUYAE_v31.png","","",""
"We all can stop the spread. Protect yourself And others.Please, stay home. Let’s work together ! All of us! #Masks4All @DCComics #fanart #PoisonIvy","","https://twitter.com/CRISDELARA_ART/status/1246542783923589122","CRISDELARA_ART","2020-04-04 20:58:53+00:00","https://pbs.twimg.com/media/EUycDIzWkAU2tVh.jpg","","",""
"@ScottAdamsSays , you'll never guess what I made my mask out of! #Masks4All #PPEshortage #staysafe #stayhome","","https://twitter.com/BartFruechte/status/1246542322126462976","BartFruechte","2020-04-04 20:57:03+00:00","https://pbs.twimg.com/media/EUyboQjWoAAdYXV.jpg","","",""
"My monthly pub crawl with friends is now virtual. And I still got my stinking badges from @untappd #youcanteachanolddog #socialdistancing #washyourhands #Masks4All ","","https://twitter.com/teresawymore/status/1246541886464065536","teresawymore","2020-04-04 20:55:20+00:00","https://pbs.twimg.com/media/EUybPEfWkAIwcd3.jpg","https://pbs.twimg.com/media/EUybPEfWoAUzuE3.jpg","https://pbs.twimg.com/media/EUybPEfXsAIckmo.jpg","https://pbs.twimg.com/media/EUybPEgWsAMdgoK.jpg"
"lol Thank you for your service! #Masks4All ","","https://twitter.com/thelionsdawn/status/1246541691156172801","thelionsdawn","2020-04-04 20:54:33+00:00","https://pbs.twimg.com/media/EUybCoRU0AAw553.jpg","","",""
"Awesome, big props to you both #Masks4All ","","https://twitter.com/thelionsdawn/status/1246541434611630082","thelionsdawn","2020-04-04 20:53:32+00:00","https://pbs.twimg.com/media/EUyaWzrXYAAnwau.jpg","","",""
"DR. OZ DIVES INTO THE CONVERSATION THE DEBATE OVER MASKS: SHOULD YOU BE WEARING FACE COVERINGS? #facemasks #Masks4All #bloods","","https://twitter.com/NYRealTalk_News/status/1246541318718926849","NYRealTalk_News","2020-04-04 20:53:04+00:00","https://pbs.twimg.com/media/EUyatJEXsAIdVkM.jpg","","",""
"When your friend looks like a badass wearing the mask you made him. #Masks4All #StopTheSpread","","https://twitter.com/HillsHandmades/status/1246541288226291715","HillsHandmades","2020-04-04 20:52:57+00:00","https://pbs.twimg.com/media/EUyasMbXkAQNxBX.jpg","","",""
"Nice one! #Masks4All ","","https://twitter.com/thelionsdawn/status/1246541093891502080","thelionsdawn","2020-04-04 20:52:11+00:00","https://pbs.twimg.com/media/EUyaIZ_UUAAhDu2.jpg","","",""
"#Easter pics look a little different this year. #Masks4All ","","https://twitter.com/lpattonTV/status/1246540917328265217","lpattonTV","2020-04-04 20:51:28+00:00","https://pbs.twimg.com/media/EUyaWayWoAA6yrY.jpg","","",""
"My office is open and we are seeing #COVID19 patients-the only PPE we have received was donated by local veterinarians!! The local hospitals look like ghost towns yet they get the masks! #Masks4All","","https://twitter.com/AngelSu88003118/status/1246540876458983426","AngelSu88003118","2020-04-04 20:51:19+00:00","https://pbs.twimg.com/media/EUtPEvuX0AMMft-.jpg","","",""
"Hello everyone, I just wanted to let you know how easy making masks were. My grandmother and I spent 3 hours making 10! I really hope you guys like them. We ran out of ribbon other wise we would have made more. Please keep this in mind if you want to make one. #Masks4All ","","https://twitter.com/SeriousNutella/status/1246540830929588225","SeriousNutella","2020-04-04 20:51:08+00:00","https://pbs.twimg.com/media/EUyaRfWU8AAJT3h.jpg","","",""
"Here’s a finished one. If you know anyone who needs one , or places accepting donations, lmk. #Masks4All #SlowTheSpread #COVID2019 #coronavirus #FlattenTheCurve","","https://twitter.com/FenixjJen77/status/1246540673525755904","FenixjJen77","2020-04-04 20:50:30+00:00","https://pbs.twimg.com/media/EUyaIZ_UUAAhDu2.jpg","","",""
"Still SHOCKED that the United States Of America cannot produce enough 79 cent Masks to keep our citizens safe? Or a 70 year old Malaria drug? Time to complete what @realDonaldTrump started... BRING AMERICAN COMPANIES HOME! #coronavirus @VP #nurses #Masks4All #Hydroxychloroquine","","https://twitter.com/Swampdo01077548/status/1246540649412820994","Swampdo01077548","2020-04-04 20:50:25+00:00","https://pbs.twimg.com/media/EUyaHPhXsAIHnF2.jpg","","",""
"#CDC wants masks? OK. But not sure how this is going to play in the supermarket! #Masks4All #Coronamask","","https://twitter.com/eessqwire/status/1246540637714944006","eessqwire","2020-04-04 20:50:22+00:00","https://pbs.twimg.com/media/EUyZrRtXYAAtJ3t.jpg","","",""
"We can HOPE! @realDonaldTrump @VP @GOP @FoxNews #COVID2019 #ShutHimUp #shelteringinplace #Masks4All @AOC @ewarren","","https://twitter.com/achernandez909/status/1246540475403812866","achernandez909","2020-04-04 20:49:43+00:00","https://pbs.twimg.com/media/EUyZ9AaWoAEahKh.jpg","","",""
"So do private doctors’ offices! We are re-using old ones that I bought at Home Depot for painting last year! Now @HomeDepot @Target etc are donating to big hospitals which already have a huge advantage over small practices!!#Masks4All @VP @realDonaldTrump","","https://twitter.com/AngelSu88003118/status/1246540160990416899","AngelSu88003118","2020-04-04 20:48:28+00:00","https://pbs.twimg.com/media/EUtPEvuX0AMMft-.jpg","","",""
"I am a rather slow seamstress, but at least the kiddo is happy with his ""ninja mask"" It will be washed before we have to leave the house (which is not the foreseeable future) #Masks4All #StayAtHome","","https://twitter.com/kemosully/status/1246539919385919488","kemosully","2020-04-04 20:47:31+00:00","https://pbs.twimg.com/media/EUyZbJ4XsAAdb-z.jpg","","",""
"If this stud can wear a mask for his Grandfather surely we can do the same. #Masks4All #COVID_19","","https://twitter.com/NealManegold/status/1246539518091481088","NealManegold","2020-04-04 20:45:55+00:00","https://pbs.twimg.com/media/EUyZFZtUwAAhwxW.jpg","","",""
"Are any of the epidemiological models out there factoring mask wearing into their projections? #Masks4All #PPENow @imperialcollege @IHME_UW @CDCgov @ASlavitt","","https://twitter.com/auerglass/status/1246539165585596417","auerglass","2020-04-04 20:44:31+00:00","https://pbs.twimg.com/media/EUrZb6eUcAEIjKZ.jpg","https://pbs.twimg.com/media/EUrZeOfU8AYTU5j.jpg","https://pbs.twimg.com/media/EUraiOYUcAEwKue.png","https://pbs.twimg.com/media/EUrakIDUcAE7wwC.png"
"Seems as though this sunscreen was “pushed” with your “right wing” addenda. Pot and kettle chump! #TrumpPressConference #TrumpIsTheWORSTPresidentEVER #TrumpPandemic @realDonaldTrump #TheStorm #China #Masks4All #Wuhan","","https://twitter.com/flippin_tired/status/1246537882229256196","flippin_tired","2020-04-04 20:39:25+00:00","https://pbs.twimg.com/media/EUyXmDYXsAI3yZ8.jpg","","",""
"Katie got her order of elastic in today! I have a #mask! @sbadayton ⁦@univofdayton⁩ flyers, these are easy to make. She plans to make more to donate. #Masks4All what others see as scrap, becomes that which helps us all. ","","https://twitter.com/profjanney/status/1246537742361780227","profjanney","2020-04-04 20:38:51+00:00","https://pbs.twimg.com/media/EUyXdxtWAAYyt5q.jpg","","",""
"There are a lot of masks with CE or FDA certification in China in stock. If any of your friends or hospitals in your country need, I can help you buy some from China. #CoronavirusPandemic #Masks4All #MasksSaveLives #FFP3 #FFP2 #PPESupplies #PPEs","","https://twitter.com/Vincentzjx/status/1246537402967089152","Vincentzjx","2020-04-04 20:37:31+00:00","https://pbs.twimg.com/media/EUyWepcXsAMkOUC.jpg","https://pbs.twimg.com/media/EUyWfaRWoAAFbd1.jpg","https://pbs.twimg.com/media/EUyWgqwXYAEBLEm.jpg","https://pbs.twimg.com/media/EUyWhg8WAAEaQAT.jpg"
"#Masks4All #COVID19 Diapers are a good alternative too.","","https://twitter.com/DesmondBoko/status/1246537402694451201","DesmondBoko","2020-04-04 20:37:31+00:00","https://pbs.twimg.com/media/EUyXJtlWoAMv2Vt.jpg","","",""
"#mascherinepertutti #Masks4All #maskchallenge I PROTECT YOU, YOU PROTECT ME !! ","","https://twitter.com/payal_agg/status/1246537170271244288","payal_agg","2020-04-04 20:36:35+00:00","https://pbs.twimg.com/media/EUyW8LmWsAMnx4j.jpg","","",""
"This will be me on Monday #COVID2019 #Masks4All ","","https://twitter.com/JuicyRamons/status/1246537062918107136","JuicyRamons","2020-04-04 20:36:09+00:00","https://pbs.twimg.com/media/EUyW2jxX0AEjuHw.jpg","","",""
"I mean it seems legit #SaturdayMood #coronavirus #Masks4All #CoronaMasks","","https://twitter.com/ChadWst/status/1246536892327309312","ChadWst","2020-04-04 20:35:29+00:00","https://pbs.twimg.com/media/EUyWsdtWkAILMUo.jpg","","",""
"Hunkered Down Day 24 - What a strange time we live in, when bits of coated wire are an exciting find. #Masks4All ","","https://twitter.com/mt_lass/status/1246536855719268353","mt_lass","2020-04-04 20:35:20+00:00","https://pbs.twimg.com/media/EUyWqA-U4AAP58g.jpg","","",""
"Is your plan for everyone to stay home for the next 18 months until a vaccine is rolled out? In the countries that have been successful in stopping the virus, everyone wears masks, and they have begun to regain some normalcy in their lives. #Masks4All","","https://twitter.com/MasksAsap/status/1246536680057778183","MasksAsap","2020-04-04 20:34:38+00:00","https://pbs.twimg.com/media/EUxxdmIWoAEHec5.jpg","https://pbs.twimg.com/media/EUxyODRXsAQU0Nm.png","https://pbs.twimg.com/media/EUxyODTXQAAZfOu.jpg",""
"Made a #mask today I'm working on the second one. Based off this: https://www.nytimes.com/article/how-to-make-face-mask-coronavirus.html?utm_source=pocket-newtab But you can also follow this https://www.cdc.gov/coronavirus/2019-ncov/prevent-getting-sick/diy-cloth-face-coverings.html #COVID19Pandemic #facemask #Masks4All ","https://www.nytimes.com/article/how-to-make-face-mask-coronavirus.html?utm_source=pocket-newtab,https://www.cdc.gov/coronavirus/2019-ncov/prevent-getting-sick/diy-cloth-face-coverings.html","https://twitter.com/buzzbuzzabee/status/1246535965390274564","buzzbuzzabee","2020-04-04 20:31:48+00:00","https://pbs.twimg.com/media/EUyV2oZXQAAq1VP.jpg","","",""
"He is a joke #COVID2019 #coronavirus #QuarantineActivities #Masks4All #KushnerIsAnIdiot #TrumpOwnsEveryDeath #CCPVirus #Masks #BREAKING #JaredKushnerForPrison","","https://twitter.com/margie_hathaway/status/1246535807336239104","margie_hathaway","2020-04-04 20:31:10+00:00","https://pbs.twimg.com/media/EUyVs40UwAAtDRW.jpg","","",""
"The new reality. Safely walking the dog. #Masks4All ","","https://twitter.com/dgrounds/status/1246535805352493061","dgrounds","2020-04-04 20:31:10+00:00","https://pbs.twimg.com/media/EUyVpokXQAIijb0.jpg","","",""
"Lovens & Lytton: Moinho Da Asneira · À Cerca Da Bela Vista À Graça I think the two Pauls may actually be on to something with these improvised face covers, making do with what they've got. Need work to allow vision though. Estimated effectiveness: 6/10 #Masks4All ","","https://twitter.com/fabiolug/status/1246535752223252481","fabiolug","2020-04-04 20:30:57+00:00","https://pbs.twimg.com/media/EUxsGnVXsAAgqrl.jpg","","",""
"i just did it myself #Masks #Masks4All ","","https://twitter.com/The_Holocron/status/1246535500803932160","The_Holocron","2020-04-04 20:29:57+00:00","https://pbs.twimg.com/media/EUxRlyVXkAAZvrS.jpg","","",""
"He is a joke #COVID2019 #TrumpPlague #TrumpPandemic #TrumpMadness #GOPBetrayedAmerica #Masks4All #MarieAntoineTrump #KushnerIsAnIdiot #JaredKushnerForPrison #StayAtHome","","https://twitter.com/margie_hathaway/status/1246535311439450112","margie_hathaway","2020-04-04 20:29:12+00:00","https://pbs.twimg.com/media/EUyVQgeUMAAMmIH.jpg","","",""
"He is a joke #COVID2019 #TrumpIsTheWORSTPresidentEVER #Trump2020 #TrumpOwnsEveryDeath #TrumpCrimeFamily #TrumpLiesAmericansDie #MarieAntoineTrump #StayAtHome #Masks4All #VentilatorShortage #KushnerIsAnIdiot","","https://twitter.com/margie_hathaway/status/1246535003728531457","margie_hathaway","2020-04-04 20:27:59+00:00","https://pbs.twimg.com/media/EUyU-o3U8AAzhpk.jpg","","",""
"@Cary_Elwes How did you know #SocialDistance #COVID2019 #Masks4All ","","https://twitter.com/KistnerSteve/status/1246534885071863808","KistnerSteve","2020-04-04 20:27:30+00:00","https://pbs.twimg.com/media/EUyU3pzWsAYqgwJ.jpg","","",""
"'Cases in 7 days if unchanged doubling time' I think I have to stop looking at charts, this is beyond depressing. People better get used to wearing masks fast. Real fast. #Masks4All #WearAMask #WearAMaskNow #MaskUp #MaskOn #COVID19 #Coronavirus https://covidgraph.com/#curve","https://covidgraph.com/#curve","https://twitter.com/wearamasknow/status/1246534685045469184","wearamasknow","2020-04-04 20:26:43+00:00","https://pbs.twimg.com/media/EUyRRLzWkAAakgd.jpg","","",""
"Masks give a false sense of security, just like condoms and seatbelts. #Masks4All ","","https://twitter.com/profbof/status/1246534243574059009","profbof","2020-04-04 20:24:57+00:00","https://pbs.twimg.com/media/EUyUSFsX0AAKq9K.jpg","","",""
"Had no thread, but 2 elastic hair ties and 2 safety pins did the trick. #Masks4All ","","https://twitter.com/yeamal/status/1246534000836894721","yeamal","2020-04-04 20:23:59+00:00","https://pbs.twimg.com/media/EUyT6ERU4AEe_wr.jpg","","",""
"Make someone SMILE with your homemade bandana masks...we have paper mask under and off to run and hike alone on an isolated stream filled trail deep in the tall trees! #welovesnoopy #masks4all #socialdistancing #trailrunning #yogicempoweredsolutions #AngelsOfStrengthAS1 ","","https://twitter.com/OmOrganicMedia/status/1246533635991207936","OmOrganicMedia","2020-04-04 20:22:32+00:00","https://pbs.twimg.com/media/EUyTusMUUAAFpL4.jpg","","",""
"1918, wear a mask or go to jail. #Masks4All #COVID2019","","https://twitter.com/Hernan_Rodz/status/1246533617364459523","Hernan_Rodz","2020-04-04 20:22:28+00:00","https://pbs.twimg.com/media/EUyTgJ1XgAMqWP2.jpg","","",""
"For some fun feel free to reply with a picture of your own #radical #mask ! #Masks4All","","https://twitter.com/RadicalAIPod/status/1246533432097804298","RadicalAIPod","2020-04-04 20:21:44+00:00","https://pbs.twimg.com/media/EUyQ9joU8AAvQ1w.jpg","","",""
"Seeking tools and resources for mental, emotional and overall logistical preparation for at least a year of social distancing. #COVID2019 #SocialDistancingNow #Masks4All #lockdown #BillGates #TheDailyShow","","https://twitter.com/AlphabetSuit/status/1246532693342318592","AlphabetSuit","2020-04-04 20:18:48+00:00","https://pbs.twimg.com/media/EUyS4ACUwAAYdoe.jpg","","",""
"Thanks @MaskMatch !! Now I’m ready to work #CRNA #COVID2019 #Masks4All ","","https://twitter.com/diamond_laty/status/1246532686589591553","diamond_laty","2020-04-04 20:18:46+00:00","https://pbs.twimg.com/media/EUyS2lFWAAMY1gs.jpg","","",""
"#Masks4All #StayHomeSavesLives #WashHands Read, learn, share http://masks4all.co","http://masks4all.co","https://twitter.com/USAmailbox/status/1246531886828134400","USAmailbox","2020-04-04 20:15:35+00:00","https://pbs.twimg.com/media/EUySJCQXgAMNl6x.jpg","","",""
"Found beauty, 7/365 43rd year of life, and masks provided by Dee! #foundbeauty #beauty #selfcare #survivor #picoftheday #PictureOfTheDay #picture #photooftheday #365days #april #QuarentineLife #Masks4All #mask #weakimmunesystem","","https://twitter.com/ThoughtsInstead/status/1246531719139917826","ThoughtsInstead","2020-04-04 20:14:55+00:00","https://pbs.twimg.com/media/EUyR6xSWsAEjiq_.jpg","","",""
"#WearAMask #Masks4All Best Scarf &amp; Bandana pictures. The New Fashion #maskchallange #SaturdayThoughts #SaturdayVibes #SaturdayMotivation #mask #SaturdayMorning @CDCgov #COVID19Pandemic #CDC #SocialDistancing #CoronavirusUS #COVID19 #fox #CNN #coronavirus #CornavirusOutbreak","","https://twitter.com/AlanPortell/status/1246531147481452555","AlanPortell","2020-04-04 20:12:39+00:00","https://pbs.twimg.com/media/EUyRdnmWoAEgcR-.jpg","https://pbs.twimg.com/media/EUyRdnmWkAElD1Q.jpg","",""
"#USA vs #Europe - The War For #FaceMasks Get Ugly As The U.S. Accused Of Piracy &amp; Paying 3 Times Cash - http://www.financetwitter.com/2020/04/usa-vs-europe-the-war-for-face-masks-get-ugly-as-the-united-states-accused-of-piracy-paying-three-times-cash.html #COVID2019 #COVID19 #CoronavirusUSA #Germany #France #Pandemic #Outbreak #InfectionControl #Masks4All #DonaldTrump #AngelaMerkel #EmmanuelMacron #CDC","http://www.financetwitter.com/2020/04/usa-vs-europe-the-war-for-face-masks-get-ugly-as-the-united-states-accused-of-piracy-paying-three-times-cash.html","https://twitter.com/financetwitting/status/1246530894237700109","financetwitting","2020-04-04 20:11:39+00:00","https://pbs.twimg.com/media/EUyRLLuWAAAMzbW.jpg","","",""
"To help kids normalize the idea that many people will now be wearing masks, we placed this in our window. #SaturdayThoughts #COVIDIOT #StayHome #StayAtHome #TrumpPressBriefing #Masks4All ","","https://twitter.com/SteveKinholt/status/1246530725731389440","SteveKinholt","2020-04-04 20:10:59+00:00","https://pbs.twimg.com/media/EUyRFYqU0AAV4lf.jpg","","",""
"I made masks for my family today. Don't invade my space. #spaceinvaders #MasksNow #Masks4All #TeacherLife #grateful #DoingMyPartCO","","https://twitter.com/crafterev/status/1246530668286210048","crafterev","2020-04-04 20:10:45+00:00","https://pbs.twimg.com/media/EUyQ9CMUwAAezFv.jpg","","",""
