"text","links","permalink","username","date","photo0","photo1","photo2","photo3"
"My mom made masks for me and my family. They have nice soft flannel on the inside and are super comfy (and fashionable)! #MaskUpPA #Masks4All ","","https://twitter.com/teribrownmusic/status/1246530651660173312","teribrownmusic","2020-04-04 20:10:41+00:00","https://pbs.twimg.com/media/EUyRA6ZXgAIX6W8.jpg","","",""
"CDC now recommends using a face covering if you must leave your home. Here how to do it minimal sewing skills! What you need: Least favorite short sleeved shirt 2 Hair bands or rubber bands Twisty tie(from bread) Needle and thread #Masks4All #StayHome #DemCast","","https://twitter.com/DemocracyStorm/status/1246530595708112896","DemocracyStorm","2020-04-04 20:10:28+00:00","https://pbs.twimg.com/media/EUyQ961WAAEGK9a.jpg","","",""
"Easy youtube videos available. Search #Masks4All ","","https://twitter.com/dandilion1115/status/1246530567534833664","dandilion1115","2020-04-04 20:10:21+00:00","https://pbs.twimg.com/media/EUxlb1uXQAIRTNi.jpg","","",""
"for #NationalHandmadeDay, can you #vegan-ize your #homeMade-#masks? #Covid19-#Masks4All #coronavirus #MaskNow","","https://twitter.com/veganimated/status/1246530324843991041","veganimated","2020-04-04 20:09:23+00:00","https://pbs.twimg.com/media/EUyQA4LUwAAYTSe.jpg","","",""
"Nobody cared until I put on the mask... #Masks4All #Masks #MaskUp #MaskShaming","","https://twitter.com/chinajoebiden/status/1246530299317665792","chinajoebiden","2020-04-04 20:09:17+00:00","https://pbs.twimg.com/media/EUyQsswWAAAge0t.jpg","","",""
"Perfect analogy. I was assembling for on #Masks4All last week (making a case) and stumbled into this convo among med workers. Frightening. Shows how poorly CDC/gov supports them w/info. Ck info from China. Virus spread on hair/eyelashes! Think abt that! https://twitter.com/emergencymndset/status/1244036669973712897?s=21","https://twitter.com/emergencymndset/status/1244036669973712897?s=21,https://twitter.com/emergencymndset/status/1244036669973712897","https://twitter.com/words_matter18/status/1246530290912239616","words_matter18","2020-04-04 20:09:15+00:00","https://pbs.twimg.com/media/EUx_k9WWsAMub-e.jpg","","",""
"Zeus is ready! #maskon #StayAtHome #staysafe #Masks4All ","","https://twitter.com/blphillips81/status/1246530161027284993","blphillips81","2020-04-04 20:08:44+00:00","https://pbs.twimg.com/media/EUyEB4eXkAIkKmj.jpg","","",""
"Followed the advice of @CDCgov and @Surgeon_General’s tips on cloth face covering. What do you think? I may use a more discreet one outdoor though... #FlattenTheCurve #Masks4All @ussoccerfndn @benjaminhaddad @ErikBrattberg @DanielFiott @ishaantharoor @PoliticoRyan @dcunited","","https://twitter.com/caudronmartin/status/1246529227803045893","caudronmartin","2020-04-04 20:05:01+00:00","https://pbs.twimg.com/media/EUyPuQNWsAA8Sme.jpg","","",""
"#blacktwitter At this point, if you can smell the w.e.e.d. wafting off a ninja then you sucking up her #coronavirus flavour too just saying! #Masks4All #StayTheFHome","","https://twitter.com/Weedmates4U/status/1246529148161417216","Weedmates4U","2020-04-04 20:04:42+00:00","https://pbs.twimg.com/media/EUyPpydUEAAMlpc.jpg","","",""
"Aarrgh. 2 down! Back is soft flannel :) #COVID19Pandemic #StayAtHome #Masks4All ","","https://twitter.com/NKelleherAuthor/status/1246528526792171522","NKelleherAuthor","2020-04-04 20:02:14+00:00","https://pbs.twimg.com/media/EUyPFhcXsAENLH0.jpg","","",""
"Everyone is ready with their masks. #ROC #Coronovirus #Masks4All ","","https://twitter.com/ACTIONGIRL12/status/1246528113422536704","ACTIONGIRL12","2020-04-04 20:00:36+00:00","https://pbs.twimg.com/media/EUyOtGGX0AEF_vv.jpg","","",""
"How to Significantly Slow Coronavirus? (featuring Minister of Health of the Czech Rep.) #Masks4All Mar 28, 2020 https://www.youtube.com/watch?v=jZtEX2-n2Hc","https://www.youtube.com/watch?v=jZtEX2-n2Hc","https://twitter.com/occupykeanuniv2/status/1246527970258419713","occupykeanuniv2","2020-04-04 20:00:02+00:00","https://pbs.twimg.com/media/EUsjbb0X0AICz2B.jpg","","",""
"How to Significantly Slow Coronavirus? (featuring Minister of Health of the Czech Rep.) #Masks4All Mar 28, 2020 https://www.youtube.com/watch?v=jZtEX2-n2Hc","https://www.youtube.com/watch?v=jZtEX2-n2Hc","https://twitter.com/occupykeanuniv2/status/1246527858857644035","occupykeanuniv2","2020-04-04 19:59:35+00:00","https://pbs.twimg.com/media/EUtDB-TXYAY2cTa.jpg","","",""
"Treasures found #Masks4all #COVID2019 #WHO","","https://twitter.com/WhiteGreyMatter/status/1246527852503347204","WhiteGreyMatter","2020-04-04 19:59:34+00:00","https://pbs.twimg.com/media/EUyOdLmWkAI2Ra5.jpg","","",""
"Now they recommend everyone wear a non medical grade #mask so made one #diyfacemask #Masks4All ","","https://twitter.com/adeekshith/status/1246527790234681347","adeekshith","2020-04-04 19:59:19+00:00","https://pbs.twimg.com/media/EUyOIPiXYAkuKfO.jpg","https://pbs.twimg.com/media/EUyOIPVXkAAMDIn.jpg","",""
"He is a joke #coronavirus #COVID19 #Masks4All #mask #mask #trunk #heisajoke","","https://twitter.com/MarkMetropolis/status/1246526981316829184","MarkMetropolis","2020-04-04 19:56:06+00:00","https://pbs.twimg.com/media/EUyNrmFUEAEo-kD.jpg","","",""
"Better Safe than sorry. Not for me, but for ppl around me.. (and yes, I really can use a sewing machine) #COVID2019 #StayAtHome #Masks4All ","","https://twitter.com/tibbs4gaming/status/1246526388301107200","tibbs4gaming","2020-04-04 19:53:44+00:00","https://pbs.twimg.com/media/EUyNIuYWkAETN0m.jpg","","",""
"Serger is totes faster... #Masks4All #Masks #mask @MakeMasks","","https://twitter.com/Sun_Daze_11/status/1246526313780805632","Sun_Daze_11","2020-04-04 19:53:27+00:00","https://pbs.twimg.com/media/EUyNEqGU8AAVjQ0.jpg","","",""
"Life before my Italian Mama’s #COVID2019 care package. And Life after. I wish everyone had an loving &amp; thoughtful Italian Mama like mine. @diana_magaldi #Masks4All #Gloves #TheNewNormal #coronavirus emergency essential kit must include #pastina #pasta ! #italians ","","https://twitter.com/DanielleBisutti/status/1246525574488584192","DanielleBisutti","2020-04-04 19:50:30+00:00","https://pbs.twimg.com/media/EUyMY8bUcAAnksn.jpg","https://pbs.twimg.com/media/EUyMY8bUEAAxPqu.jpg","https://pbs.twimg.com/media/EUyMY8bU4AArHQt.jpg",""
"We made this one last night - not the prettiest, but no sew, fast, requires the least number of things. The video is via @BoingBoing https://boingboing.net/2020/04/03/anyone-can-make-tora-smarts.html. Article by @edyong209 https://www.theatlantic.com/health/archive/2020/04/coronavirus-pandemic-airborne-go-outside-masks/609235/ #Masks4All ","https://boingboing.net/2020/04/03/anyone-can-make-tora-smarts.html,https://www.theatlantic.com/health/archive/2020/04/coronavirus-pandemic-airborne-go-outside-masks/609235/","https://twitter.com/lilita_yaya/status/1246524869275078656","lilita_yaya","2020-04-04 19:47:42+00:00","https://pbs.twimg.com/media/EUyLLnlUwAAxdJD.jpg","","",""
"Do you think @JeriLRyan Would be up for a Spread campaign? #NoSpread #Masks4All #masks4allUSA","","https://twitter.com/john_kaser/status/1246524103118344192","john_kaser","2020-04-04 19:44:40+00:00","https://pbs.twimg.com/media/EUyEwNjVAAAXsHH.jpg","","",""
"Home made mask from t shirt is complete. Bonus: I now have a belly shirt. #Masks4All ","","https://twitter.com/spikeballchris/status/1246523898755194881","spikeballchris","2020-04-04 19:43:51+00:00","https://pbs.twimg.com/media/EUyK38HXYAAojJD.jpg","https://pbs.twimg.com/media/EUyK38JXgAA9b4z.jpg","",""
"Be like #sexyeddie and #Masks4All your muzzle. ","","https://twitter.com/MelanieDoctors/status/1246523682702233601","MelanieDoctors","2020-04-04 19:42:59+00:00","https://pbs.twimg.com/media/EUyKranUYAEL8AF.jpg","","",""
"Many easy DIY mask tutorials on youtube. #Masks4All","","https://twitter.com/dandilion1115/status/1246522960178860033","dandilion1115","2020-04-04 19:40:07+00:00","https://pbs.twimg.com/media/EUxEViqWoAAZDVA.jpg","","",""
"#StayHome however if you need to step out and shop groceries for yourself or others, make sure to wear a mask. Let’s protect each other #masks4all ","","https://twitter.com/Java01208206/status/1246522664371523584","Java01208206","2020-04-04 19:38:57+00:00","https://pbs.twimg.com/media/EUyJv66XQAAaw6j.jpg","","",""
"I #WearMask because of YOU! #Masks4All ","","https://twitter.com/Last2g/status/1246522543596429312","Last2g","2020-04-04 19:38:28+00:00","https://pbs.twimg.com/media/EUyJpHkU0AEgpvB.jpg","","",""
"Bout to get our nature hike on. #California #lockdown #QuarantineLife #Caturday #SaturdayMorning #SaturdayThoughts #photographer #Repost #Masks4All #lifestyle #selfie #nature #NewYork #newworldorder #humor #BreakingNews #beach #justforfun #coronavirus","","https://twitter.com/thegiftedone32/status/1246522224703467520","thegiftedone32","2020-04-04 19:37:12+00:00","https://pbs.twimg.com/media/EUyJWmQUMAAy_GE.jpg","","",""
"Somehow my pic made it on @NBCNews @NBCNewsNow! #Masks4All! ","https://www.nbcnews.com/think/opinion/coronavirus-mask-guidance-remains-unclear-here-s-how-history-can-ncna1174451","https://twitter.com/DorisWangLab/status/1246522151475138561","DorisWangLab","2020-04-04 19:36:54+00:00","https://pbs.twimg.com/media/EUVwWs5UYAEkSVG.jpg","","",""
"Still smiling! Promise! Still reppin’ @united! #beingUnited #HangInThere #Masks4All #StayHealthyAndHappy","","https://twitter.com/Cheryl_Searle/status/1246522031941627904","Cheryl_Searle","2020-04-04 19:36:26+00:00","https://pbs.twimg.com/media/EUyJLcjUEAAaDsY.jpg","","",""
"I did the #OperationInspiration @iRunFar run around my hood, to honor @jeremyphoward and @math_rachel who championed the #Masks4All movement in the US. For their tenacity to stand for truth, for rallying the troops Thank you! Learn here: https://masks4all.co/","https://masks4all.co/","https://twitter.com/ram_ssk/status/1246521298009772032","ram_ssk","2020-04-04 19:33:31+00:00","https://pbs.twimg.com/media/EUyFyhUUUAAA9KN.jpg","https://pbs.twimg.com/media/EUyG8bmU4AAB83n.jpg","https://pbs.twimg.com/media/EUyHHEPUYAYq_xv.jpg","https://pbs.twimg.com/media/EUyHQbwU0AAscoj.jpg"
"Keep safe - yourself, your family, those around you. Wear a mask if you leave the house. #Masks4All ","","https://twitter.com/courtneydawn/status/1246521025782861824","courtneydawn","2020-04-04 19:32:26+00:00","https://pbs.twimg.com/media/EUyIQReWkAMUmDc.jpg","","",""
"My company is an FDA-registered medical supplier. PPE in large quantities: masks, gowns face shields gloves. DM me! #Masks4All","","https://twitter.com/MerkinChief/status/1246520876616617985","MerkinChief","2020-04-04 19:31:50+00:00","https://pbs.twimg.com/media/EUs1SEmXQAYoLZP.jpg","","",""
"I made my first mask! #Masks4All ","","https://twitter.com/JoeLivernois/status/1246520713680314369","JoeLivernois","2020-04-04 19:31:12+00:00","https://pbs.twimg.com/media/EUyH-SRU8AAvRkN.jpg","","",""
"I can supply Michigan with PPE! FDA-registered medical supplier. Please DM me! #Masks4All","","https://twitter.com/MerkinChief/status/1246520397232844800","MerkinChief","2020-04-04 19:29:56+00:00","https://pbs.twimg.com/media/EUsxb8LWkAAgYKm.jpg","","",""
"#Masks4All #COVID2019 #latimes #abc7eyewitness #entrepreneur Lincoln &amp; Broadway Santa Monica","","https://twitter.com/ADH1204/status/1246520187404206080","ADH1204","2020-04-04 19:29:06+00:00","https://pbs.twimg.com/media/EUyHgJRVAAAdMRy.jpg","","",""
"#WearAMask #Masks4All The Best Scarf &amp; Bandana pictures. The New Fashion #maskchallange #SaturdayThoughts #SaturdayVibes #SaturdayMotivation #SaturdayMorning #covid_2019 #SocialDistancing #mask #COVID19 #COVIDIDIOT #coronavirus #CornavirusOutbreak #CoronavirusUS #CDC @CDCgov","","https://twitter.com/merryjoportell/status/1246519412997357571","merryjoportell","2020-04-04 19:26:01+00:00","https://pbs.twimg.com/media/EUyGy5nWsAMZM57.jpg","https://pbs.twimg.com/media/EUyGy5mXkAAXW86.jpg","",""
"Better if she honoured them with proper #PPE A medal's not much use to you when you're dead #Masks4All ","http://Masks4all.co","https://twitter.com/cto_maverick/status/1246519234169053187","cto_maverick","2020-04-04 19:25:19+00:00","https://pbs.twimg.com/media/EUvUkPBWkAAJrBJ.jpg","","",""
"We’re still taking orders for African Face Masks. Here are the new designs, available in adult & kids sizes. 250/- per mask, 200/- for 15 or more masks. You can call 0757464633 to book your order. #MasksNow #Masks4All ","","https://twitter.com/KoomeGitobu/status/1246518928865660928","KoomeGitobu","2020-04-04 19:24:06+00:00","https://pbs.twimg.com/media/EUyGVytXkAA7jw9.jpg","https://pbs.twimg.com/media/EUyGV3gXYAEEhOp.jpg","https://pbs.twimg.com/media/EUyGWBBXgAAum_6.jpg",""
"Hey wear a mask! #masks4all ","","https://twitter.com/phneep/status/1246518923140435968","phneep","2020-04-04 19:24:05+00:00","https://pbs.twimg.com/media/EUyGTjmXYAISmgU.jpg","","",""
"Stay safe y'all #COVID2019 #COVIDー19 #WearMaskStaySafe #Masks4All – at The Roseberry","","https://twitter.com/streetfare_/status/1246518520201883648","streetfare_","2020-04-04 19:22:29+00:00","https://pbs.twimg.com/media/EUyF_F3XsAE09FD.jpg","","",""
"completely disorganised but normalising the mask #Masks4All ","","https://twitter.com/gnostiquette/status/1246517490500452354","gnostiquette","2020-04-04 19:18:23+00:00","https://pbs.twimg.com/media/EUyFBnDXkAAqLxy.jpg","","",""
"The lies that were told to us about masks could be forgivable in the context of trying to preserve PPE for frontline workers. What is not forgivable is the continued heel dragging on promoting mask usage by the general public. #Masks4All","","https://twitter.com/MasksAsap/status/1246517335940358144","MasksAsap","2020-04-04 19:17:46+00:00","https://pbs.twimg.com/media/EUxF_KrX0AExqdm.jpg","","",""
"#Masks4All This is not Rocket Science!! 1918 ","","https://twitter.com/Marco73838565/status/1246517326981332992","Marco73838565","2020-04-04 19:17:44+00:00","https://pbs.twimg.com/media/EUyE5lsWoAUzObf.jpg","","",""
"Despite @GovNedLamont's Executive Order 7S calling for masks to be worn by employees, @bigyfoods markets are not in compliance. @WilliamTongCT &amp; @CTDPH please immediately enforce the law to protect worker health and community safety! #Masks4All","","https://twitter.com/RealDemVoter1/status/1246517288007860224","RealDemVoter1","2020-04-04 19:17:35+00:00","https://pbs.twimg.com/media/EUcWLy8WsAQIYO-.jpg","","",""
"One more time, because no one talking about masks is addressing this! Exhaled air coming out of air flow valves in masks like this N95 is NOT filtered and CAN infect others if you are unknowingly a carrier of #COVID19 #Masks4All #MasksSaveLives #N95mask #coronavirus","","https://twitter.com/FaeryAngela/status/1246516853737844737","FaeryAngela","2020-04-04 19:15:51+00:00","https://pbs.twimg.com/media/EUyD8i4UUAEnnAY.jpg","","",""
"Thank you for sharing your story. That is truly shameful and a direct byproduct of our failed leadership in Canada. Your wife did the right thing. #Masks4All","","https://twitter.com/MasksAsap/status/1246516581250879489","MasksAsap","2020-04-04 19:14:46+00:00","https://pbs.twimg.com/media/EUxF_KrX0AExqdm.jpg","","",""
"Wear a mask if you have to go out. Stay safe! Full body? Just a bit too much me thinks #Masks4All ","","https://twitter.com/titusjames_/status/1246516482915414016","titusjames_","2020-04-04 19:14:23+00:00","https://pbs.twimg.com/media/EUyEG0bX0AAIlK6.jpg","https://pbs.twimg.com/media/EUyEHc_WsAIaidS.jpg","https://pbs.twimg.com/media/EUyEIKvXsAAhWNM.jpg",""
"Mom gave me some masks for #Masks4All #MaskUp but, er, I have a petite face: the thing looked like a droopy diaper. #StayHealthyEveryone #rona #pandemic","","https://twitter.com/RamblinRame/status/1246516332637630469","RamblinRame","2020-04-04 19:13:47+00:00","https://pbs.twimg.com/media/EUyD_2sXgAM7sDW.jpg","","",""
"Newer, pithy, we tell the author's story, add our research, crime/psych analysis, updates, and lots of FUN. Join us and #BeatTheVirus ! #truecrimepodcast #truecrime #podcast #podcaster #SaturdayMotivation #StayHomeSaveLives #Masks4All #listenlive #readingcommunity #Read #BookClub","","https://twitter.com/shelf_club/status/1246515890750881794","shelf_club","2020-04-04 19:12:02+00:00","https://pbs.twimg.com/media/EUyDCJQWoAA5q0r.jpg","","",""
"Great, Paula! Stay safe! #mask #Masks4All #SocialDistancing #coronavirus #COVID19","","https://twitter.com/HaroldSinnott/status/1246515773339828230","HaroldSinnott","2020-04-04 19:11:34+00:00","https://pbs.twimg.com/media/EUxcH-EXgAEEL3g.jpg","","",""
"The Residents: Eskimo The Residents don't fuck around. Their trademark eyeball helmets protect the entire head providing peace of mind. The rest of the outfit's sharpness is proof of how cool their heads are. I think we have a winner! Estimated effectiveness: 9/10 #Masks4All ","","https://twitter.com/fabiolug/status/1246515253967572993","fabiolug","2020-04-04 19:09:30+00:00","https://pbs.twimg.com/media/EUxsGnVXsAAgqrl.jpg","","",""
". @jeremyphoward either you need better SEO...or is this the surprising next phase of #Masks4All ? ","","https://twitter.com/kurtosis0/status/1246515251547238400","kurtosis0","2020-04-04 19:09:29+00:00","https://pbs.twimg.com/media/EUyCQdyUUAYSMkr.jpg","","",""
"mask (n) from Arabic maskharah ""buffoon, mockery"" or ""dark cloud before the rain comes."" https://www.etymonline.com/word/mask #Masks4All ","https://www.etymonline.com/word/mask","https://twitter.com/50Fitty/status/1246515214889021440","50Fitty","2020-04-04 19:09:21+00:00","https://pbs.twimg.com/media/EUyCjd1VAAAriOh.jpg","","",""
"This meme needed to exist. #PacificRim #Coronavirus #Covid19 #Masks4All #WeAreInThisTogether","","https://twitter.com/simmeringmind/status/1246515149164482560","simmeringmind","2020-04-04 19:09:05+00:00","https://pbs.twimg.com/media/EUyB_p2WkAU01w8.jpg","","",""
"Face masks, face masks, face masks, for community protection in public places. Follow insights from China, South Korea, Czech Republic, ........... #Masks4All https://masks4all.org/","https://masks4all.org/","https://twitter.com/StTogether1/status/1246514699962855425","StTogether1","2020-04-04 19:07:18+00:00","https://pbs.twimg.com/media/EUyCIgPXkAASiGy.jpg","https://pbs.twimg.com/media/EUyCMDWWkAEKZKX.png","",""
"We need more medical #masks, especially for the people who are on the #frontline, healthcare workers, EMTs, Firefighters, &amp; the Police, but also for the public too. When is the government going to ask #China to return the favor and send the U.S. some medical equipment? #Masks4All ","","https://twitter.com/AlexaAdams12/status/1246513980115505154","AlexaAdams12","2020-04-04 19:04:26+00:00","https://pbs.twimg.com/media/EUyB2nEWkAEr0WP.jpg","","",""
"Why are you sharing this like it is new info? All this has been well established for 2 months now. Will it take you another 2 months to begin thinking about how we can begin to resume normality?? We need the entire population wearing masks!! #Masks4All #Masks4All","","https://twitter.com/MasksAsap/status/1246513955197124613","MasksAsap","2020-04-04 19:04:20+00:00","https://pbs.twimg.com/media/EUxF_KrX0AExqdm.jpg","","",""
"If you can't get a mask you can create it with this! https://amzn.to/2X8sRaH It's simple! take a look at this tutorial! https://www.youtube.com/watch?v=W909GJOc2PE&amp;feature=youtu.be #coronavirus #Masks4All #virus #COVID2019 #COVID19Pandemic #WashYourHands @Designsage #retweet for help!","https://amzn.to/2X8sRaH,https://www.youtube.com/watch?v=W909GJOc2PE&feature=youtu.be","https://twitter.com/KateWolfDesign/status/1246513531664633859","KateWolfDesign","2020-04-04 19:02:39+00:00","https://pbs.twimg.com/media/EUyBG_PXsAIMaw-.jpg","","",""
"#Masks4All is mandatory... after the gubmint told us all to not run out and buy them... ","","https://twitter.com/Truth_Mortar/status/1246513427629117440","Truth_Mortar","2020-04-04 19:02:14+00:00","https://pbs.twimg.com/media/EUyBWI6WkAM8HxI.jpg","","",""
"Finally found a use for that @survivorcbs #buff I got years ago...#dontdropyourbuffs where is @JeffProbst? #COVID2019 #StayHomeSaveLives #Masks4All #publichealth #SurvivorWinnersAtWar #Survivor40 #oldskoolvanuatu #survivor","","https://twitter.com/JamieSclafane/status/1246513119310028800","JamieSclafane","2020-04-04 19:01:01+00:00","https://pbs.twimg.com/media/EUyBEnZXkAIVLO0.jpg","","",""
"#WearAMask #Masks4All The Best Scarf &amp; Bandana pictures. The New Fashion #maskchallange #SaturdayThoughts #SaturdayVibes #SaturdayMotivation #SaturdayMorning #covid_2019 #SocialDistancing #mask #COVID19 #COVIDIDIOT #coronavirus #CornavirusOutbreak #CoronavirusUS #CDC @CDCgov","","https://twitter.com/merryjoportell/status/1246513070459047937","merryjoportell","2020-04-04 19:00:49+00:00","https://pbs.twimg.com/media/EUyBBFVWsAApVJv.jpg","https://pbs.twimg.com/media/EUyBBFWXgAE0dLz.jpg","",""
"Even cars are wearing makeshift masks now, good thinking! #Masks4All ","","https://twitter.com/devonArmistead/status/1246512850643763200","devonArmistead","2020-04-04 18:59:57+00:00","https://pbs.twimg.com/media/EUyA0dJVAAAMU9U.jpg","","",""
"Thank you and what about #Masks4All ? If cough etiquette is important then so are masks.","","https://twitter.com/inchbyinch_rbr/status/1246512339794493440","inchbyinch_rbr","2020-04-04 18:57:55+00:00","https://pbs.twimg.com/media/EUwpTPtXQAE5m82.jpg","","",""
"#WearAMask #Masks4All The Best Scarf &amp; Bandana pictures. The New Fashion #maskchallange #SaturdayThoughts #SaturdayVibes #SaturdayMotivation #SaturdayMorning #covid_2019 #SocialDistancing #mask #COVID19 #COVIDIDIOT #coronavirus #CornavirusOutbreak #CoronavirusUS #CDC @CDCgov","","https://twitter.com/AlanPortell/status/1246511915922345989","AlanPortell","2020-04-04 18:56:14+00:00","https://pbs.twimg.com/media/EUx_8jIXYAUI-ea.jpg","https://pbs.twimg.com/media/EUx_8jHWkAMM-H9.jpg","https://pbs.twimg.com/media/EUx_8jVXsAA8D-8.jpg","https://pbs.twimg.com/media/EUx_8jXXQAAHNsr.jpg"
"Yes @jack Please help stop #Disinformation. Every1 Stay safe, and WEAR SOMETHING OVER YOUR FACE when you go out. Asian countries have done this and it stops the spread. Respiratory droplets are emitted through your BREATH in normal conversation. #Masks4All ","https://time.com/5814139/coronavirus-state-data-tracker/","https://twitter.com/StarCreativeI/status/1246511613865328641","StarCreativeI","2020-04-04 18:55:02+00:00","https://pbs.twimg.com/media/EUx9GIjXYAATPPv.jpg","","",""
"I’m always fashion forward this pic is three weeks old #aheadofthecurve #FlattenTheCurve #StayTheFHome #Masks4All ","","https://twitter.com/ErickEsteban/status/1246511601185771520","ErickEsteban","2020-04-04 18:54:59+00:00","https://pbs.twimg.com/media/EUx_resUcAAuhSo.jpg","","",""
"I've been thinks about masks and identity for a while. It's a way to express and change social belonging. Here's my 2nd prototype, made from @phlpp7r old t shirts bike tubes coffee bean bag cincher. #Masks4All ","","https://twitter.com/LNBel/status/1246511598811963398","LNBel","2020-04-04 18:54:58+00:00","https://pbs.twimg.com/media/EUx_mfHWAAIqW35.jpg","https://pbs.twimg.com/media/EUx_ps4WAAAVFPW.jpg","",""
"Damn... Who knew this would be prophecy?! Hahaha. #princessbride #Masks4All #MasksSaveLives","","https://twitter.com/AndreEdwards06/status/1246511245005664258","AndreEdwards06","2020-04-04 18:53:34+00:00","https://pbs.twimg.com/media/EUx_XrqXsAAEhh-.jpg","","",""
"#WearAMask #Masks4All The Best Scarf &amp; Bandana pictures. The New Fashion #maskchallange #SaturdayThoughts #SaturdayVibes #SaturdayMotivation #SaturdayMorning #covid_2019 #SocialDistancing #mask #COVID19 #COVIDIDIOT #coronavirus #CornavirusOutbreak #CoronavirusUS #CDC @CDCgov","","https://twitter.com/merryjoportell/status/1246510692393517059","merryjoportell","2020-04-04 18:51:22+00:00","https://pbs.twimg.com/media/EUx-21bXYAMpVX2.jpg","https://pbs.twimg.com/media/EUx-21cXsAAGsaP.jpg","https://pbs.twimg.com/media/EUx-21qWkAA-ePa.jpg","https://pbs.twimg.com/media/EUx-212XsAAuPWi.jpg"
"Beauty! Here's my custom B's #Masks4All @NHLBruins #NHLBruins gettin some sweet looks when out for groceries....especially in southern Ontario Leafs land ","","https://twitter.com/kgordon077/status/1246510491654074373","kgordon077","2020-04-04 18:50:34+00:00","https://pbs.twimg.com/media/EUtRv5gXQAM7ARy.jpg","","",""
"We made masks today. Mom was inspired to produce a “designer mask” – Calvin Klein’s. I was deemed to be the model. Thanks Mom. #CaptainUnderpants #Masks4All ","","https://twitter.com/Imjmill/status/1246510475468300291","Imjmill","2020-04-04 18:50:31+00:00","https://pbs.twimg.com/media/EUx-qM2WoA8AH0L.jpg","","",""
"How to make your own face mask. No sewing machine required. Use Polypropylene bags if handy. Wash your extra shopping bag before cutting it up. #howto #Masks #Masks4All #MaskUp https://www.cnn.com/2020/04/04/health/how-to-make-your-own-mask-wellness-trnd/index.html","https://www.cnn.com/2020/04/04/health/how-to-make-your-own-mask-wellness-trnd/index.html","https://twitter.com/MyBlumeGlobal/status/1246510415938543617","MyBlumeGlobal","2020-04-04 18:50:16+00:00","https://pbs.twimg.com/media/EUx-mQAXkAAxq4l.jpg","","",""
"What we recommend (offer!) right now: Feel free to read our guidelines, safe handling practices, & use our patterns. #MakeMasks for you &amp; yours. And then pay it forward &amp; make a batch for us (we'll match it w needful orgs!). Stay safe out there #Masks4All #MasksNow","","https://twitter.com/MakeMasks/status/1246509701317230592","MakeMasks","2020-04-04 18:47:26+00:00","https://pbs.twimg.com/media/EUx96bJWkAE9u1P.jpg","","",""
